{
  "artifact_kind": "claim_candidates",
  "kind": "run_record",
  "live": true,
  "manifest_sha256": "486af1d390b9acd8de4fe827439975d9e198f8eef03980d4a690b2a282770229",
  "model": "claude-opus-5",
  "output_sha256": "0b48f676370b509ff5026441f66f3a80d5e003825644699ffea99be1a8c4825c",
  "prompt_sha256": "bff1114e58baf23321ed024d68c2b6188f1e28ccbff6c7af0f91fca475c22495",
  "reason": "shadow_completed",
  "runtime": "claude-code-action@ef8bb1e43bf303cff727a1dd0b8837029fe982a2",
  "schema_sha256": "bfd8917e9ab7ca0323facd889c3b282b36304ff27ec1e28c5f9976a8ab01bd27",
  "schema_version": 2,
  "status": "completed"
}
