{
  "artifact_kind": "claim_candidates",
  "kind": "run_record",
  "live": true,
  "manifest_sha256": "4de3201a96a5adcf8ce3c36641f4ff36df5f88afab37c9b083153134a40d89ef",
  "model": "claude-opus-5",
  "output_sha256": "220b452071fb9af83889fedb23c93db96b2c42aac0c7377630c58dfcddc93e7a",
  "prompt_sha256": "f6b205ac093e22267eac21cdbc418efce270c8badfe15e6363dc2b2499874fb8",
  "reason": "shadow_completed",
  "runtime": "claude-code-action@ef8bb1e43bf303cff727a1dd0b8837029fe982a2",
  "schema_sha256": "bfd8917e9ab7ca0323facd889c3b282b36304ff27ec1e28c5f9976a8ab01bd27",
  "schema_version": 2,
  "status": "completed"
}
